{
  "schema": "ming.update.cli.v1",
  "ok": true,
  "command": "status",
  "exit_code": 0,
  "error_code": null,
  "state": "committed",
  "transaction": {
    "id": "tx-20260715-0001",
    "release_id": "ming-os-26.3.3-amd64-20260715.1",
    "previous_slot": "legacy",
    "candidate_slot": "B",
    "generation": 10
  },
  "update": {
    "current_version": "26.3.3",
    "available_version": null,
    "release_id": null,
    "delivery": "none",
    "manifest_sha256": null
  },
  "action": "none",
  "progress": { "phase": "complete", "percent": 100 },
  "requires_reboot": false,
  "message_key": "update.status.committed",
  "message_args": {},
  "log_path": "/var/log/ming-update/transactions/tx-20260715-0001/engine.log",
  "timestamp": "2026-07-15T12:10:00Z"
}
