{
  "schema": "ming.update.cli.v1",
  "ok": false,
  "command": "status",
  "exit_code": 8,
  "error_code": "E_ROLLBACK_SLOT",
  "state": "rolled_back",
  "transaction": {
    "id": "tx-20260715-0001",
    "release_id": "ming-os-26.3.3-amd64-20260715.1",
    "previous_slot": "legacy",
    "candidate_slot": "B",
    "generation": 9
  },
  "update": {
    "current_version": "26.3.2",
    "available_version": "26.3.3",
    "release_id": "ming-os-26.3.3-amd64-20260715.1",
    "delivery": "transactional-slot-v1",
    "manifest_sha256": "aaaaaaaaaaaaaaaaaaaaaaaaaaaaaaaaaaaaaaaaaaaaaaaaaaaaaaaaaaaaaaaa"
  },
  "action": "none",
  "progress": { "phase": "rolled-back", "percent": 100 },
  "requires_reboot": false,
  "message_key": "update.rollback.completed",
  "message_args": {},
  "log_path": "/var/log/ming-update/transactions/tx-20260715-0001/engine.log",
  "timestamp": "2026-07-15T12:05:00Z"
}
